,review_id,product_id,reviewer_id,stars,text,review_title,language,product_category,label,pred_proba_label_negative,pred_proba_label_neutral,pred_proba_label_positive,pred_label
679,en_0727312,product_en_0861275,reviewer_en_0266708,3,I love the look of this vinyl. Only thing is it doesn’t have a second peal off layer so applying it was difficult. But my bf suggested using masking tape after weeding off the putter layer and it worked perfectly! With that help it was great for the price,Hard to apply,en,home,1,0.005951499100774527,0.05269289389252663,0.9413555860519409,2
680,en_0027735,product_en_0675895,reviewer_en_0484256,3,Let's just say they do the job. Not bad for the price.,ok for the money,en,kitchen,1,0.014558756723999977,0.1103520393371582,0.8750892281532288,2
681,en_0877496,product_en_0928040,reviewer_en_0792422,3,"I don't understand all the positive reviews, it makes your lips very dry",Very Dry,en,beauty,1,0.5517764091491699,0.38486137986183167,0.06336214393377304,0
682,en_0150572,product_en_0593882,reviewer_en_0046404,4,Good quality. It served its purpose for a costume.,Four Stars,en,kitchen,2,0.0058087860234081745,0.0328078456223011,0.9613833427429199,2
683,en_0817772,product_en_0099585,reviewer_en_0004503,3,I have a 2018 Ford Escape. The covers do fit. Since the back and seat are two different pieces I had issues with the seat part coming out. I found it to be a pain constantly re adjusting the seat part. Head rest and back of seat fit perfect. Didn’t meet my expectations but may work better for someone else.,Had issues seat part coming off,en,automotive,1,0.07888147979974747,0.5906957387924194,0.3304227888584137,1
684,en_0302654,product_en_0379939,reviewer_en_0408871,4,"The hat is nice, but the knit is too tight for the hat to show any sign of looking like it is a slouch hat!",Nice but not slouchy.,en,apparel,2,0.4089682400226593,0.5257627964019775,0.06526893377304077,1
685,en_0154578,product_en_0745690,reviewer_en_0664639,3,Once you get someone to put it together it’s good to go for a lil out Door walk but if you pushing it kind of hard to direct so your toddler will do better just paddling it’s much easier overall for what you payed for it... It’s good!,Once you get someone to put it together it’s good to go for a lil out Door walk but ...,en,toy,1,0.013236119411885738,0.12956532835960388,0.8571984767913818,2
686,en_0112130,product_en_0695362,reviewer_en_0806230,1,2001 dodge dakota. Installed fine but not bright at all. Pretty well useless.,Not worth the money.,en,automotive,0,0.9825599789619446,0.011839999817311764,0.005600006319582462,0
687,en_0604474,product_en_0796097,reviewer_en_0309909,5,"These make poaching eggs so easy! I never took the time to make poached eggs before getting these because it was a pain, but now I’m easily able to poach eggs for breakfast/brunch!",Super easy!,en,kitchen,2,0.003209304064512253,0.011403337121009827,0.9853874444961548,2
688,en_0253895,product_en_0216280,reviewer_en_0234674,2,They are not great. Too dull & tried to sharpen. We were unsuccessful.,Not what I hoped for,en,home,0,0.8873059153556824,0.10485128313302994,0.007842800579965115,0
689,en_0482497,product_en_0419024,reviewer_en_0839073,5,Work in prison and these are handy for keys and I’d.,Worked well on my wide belt.,en,sports,2,0.007716273423284292,0.03605379909276962,0.9562298655509949,2
690,en_0590404,product_en_0052360,reviewer_en_0471457,3,Love them now that they are up but had to add the contact paper to install and there was not enough and had to reuse and was not easy. Just finished so not sure how they will stick. Seem well adhered at this time.,Love them now.,en,home,1,0.07611998915672302,0.5119022130966187,0.4119778275489807,1
691,en_0584675,product_en_0458061,reviewer_en_0092311,1,"Fit as expected, minus the thigh bands being a bit too tight. My main concern is how extremely thin they are. They feel cheaply made and am certain they'll snag/run my first wear.","Fit as expected, minus the thigh bands being a ...",en,apparel,0,0.05480704456567764,0.4820815324783325,0.4631114602088928,1
692,en_0557240,product_en_0319969,reviewer_en_0245188,4,"purchased this because all of the tempered glass protectors kept cracking all the time even without dropping my phone. this screen protector feels like vinyl and even though I didn't watch the installation video, iI was able to install without a problem. Due to the liquid application, I found you can respray and start over if you made a mistake. The only thing I had to get used to is my finger didn't slide easily when swiping or playing games but it seems to have gotten better.",great screen protector,en,wireless,2,0.006297307554632425,0.031130261719226837,0.962572455406189,2
693,en_0378911,product_en_0101175,reviewer_en_0162683,3,"It is a nice bag and is exactly as advertised; however due to the size of it, if you fill it up it is too hard to carry. The bag is collapsible and thin material. It would be better in a smaller size.",Hard to carry when full due to large size,en,sports,1,0.1371081918478012,0.6449221968650818,0.21796956658363342,1
694,en_0510816,product_en_0470611,reviewer_en_0299794,4,"Nice theme for my autumn bathroom. The image is not as vibrant as I imagined, but I'm content.",Nice but lacks clarity,en,home,2,0.010589400306344032,0.10234593600034714,0.8870646953582764,2
695,en_0968488,product_en_0207787,reviewer_en_0605944,2,I paid for 40 feet of chain and received 33 feet.,Less than 40 feet.,en,home,0,0.9005089402198792,0.07809225469827652,0.02139880508184433,0
696,en_0630126,product_en_0984694,reviewer_en_0229495,4,I love how this fits and very easy to just wash and wear. The price is great too,Good quality,en,apparel,2,0.003134111175313592,0.012859612703323364,0.9840062260627747,2
697,en_0426212,product_en_0421398,reviewer_en_0692160,2,I am disappointed. The heated part does not work and I just got my replacement today,Disappointed,en,drugstore,0,0.7506306171417236,0.2349432408809662,0.014426097273826599,0
698,en_0597613,product_en_0519660,reviewer_en_0445149,1,Said 2 pack only got 1,Wrong info,en,automotive,0,0.8591363430023193,0.11535383760929108,0.025509817525744438,0
699,en_0124272,product_en_0211694,reviewer_en_0747772,5,The copper baking sheet air fryer worked well for me,No issues with smelly frying oil,en,kitchen,2,0.008950402028858662,0.05408092960715294,0.9369686245918274,2
700,en_0758632,product_en_0891956,reviewer_en_0708564,1,I have had 2 of these and the clip keeps breaking! The case is bulky and hard to hold onto to.,Clip breaks !!!!,en,wireless,0,0.7288700342178345,0.24762776494026184,0.023502307012677193,0
701,en_0315472,product_en_0057189,reviewer_en_0966626,4,Looks the same as pictured. Good quality.,Good quality,en,kitchen,2,0.0038522561080753803,0.017681973055005074,0.978465735912323,2
702,en_0606985,product_en_0333058,reviewer_en_0081429,4,good little cart for short people,assembled by purchaser,en,lawn_and_garden,2,0.010070671327412128,0.05358193442225456,0.9363473653793335,2
703,en_0203297,product_en_0942246,reviewer_en_0109741,2,I did not receive the cat eye magnet either. Pictures are deceiving. Did not receive any kind of base or top coat and the colors are not labeled in any way.,Not what it seems,en,beauty,0,0.9416459798812866,0.05328180640935898,0.005072261206805706,0
704,en_0980039,product_en_0221537,reviewer_en_0600287,2,A little deceiving from Facebook add looked like a rubber mask not plastic. Suit seems fine .,Somewhat disappointed,en,apparel,0,0.08621101081371307,0.6632367968559265,0.250552237033844,1
705,en_0821499,product_en_0572340,reviewer_en_0401483,2,Great however small for the average size wrist. Not sure of we received an exceptionally small band. Great product but wish it came with additional links. Will have to return sadly.,Smaller than expected. Does not fit average size wrist.,en,wireless,0,0.11453484743833542,0.6630104780197144,0.2224547117948532,1
706,en_0221121,product_en_0414372,reviewer_en_0286914,3,I do not like the fact that it is smaller than the cushion of the dining room chair. Although it stretches and does fit . It could be just a little larger in size. I also have the full covered chair cushions which are nice but I noticed also with these that they are pulling apart in some areas.,Size,en,home,1,0.07212993502616882,0.645789623260498,0.28208041191101074,1
707,en_0701137,product_en_0175690,reviewer_en_0248708,1,"Never recieved this item... First bad experience on amazon. No reply from seller. 3rd party seller, will NOT do again if I can help it.","BAD CUSTOMER SERVICE 3RD PARTY SELLER. NEVER GOT IT, NO REPLIES ON EMAILS.",en,toy,0,0.9820735454559326,0.012853836640715599,0.005072620697319508,0
708,en_0504639,product_en_0636961,reviewer_en_0978032,5,"This is such a great starter case for those just started their essential oil collection. The case is padded so oils will stay protected and it also has a handle. The case also comes with all the roller balls, droppers, key and funnel as described. I bought the bright pink case. I should have bought two because mine is already filled.",Nice little case.,en,drugstore,2,0.0036399418022483587,0.011526096612215042,0.9848339557647705,2
709,en_0723124,product_en_0228717,reviewer_en_0871323,1,"I bought a six pack of this product, but three of them were a different kind of deodorant I don’t use.",Only got half of what I wanted,en,beauty,0,0.8644047379493713,0.1209554448723793,0.014639780856668949,0
710,en_0613121,product_en_0538885,reviewer_en_0141443,4,I wish the shirt was a little more form fitting.,Four Stars,en,apparel,2,0.08294788002967834,0.5345372557640076,0.3825148642063141,1
711,en_0300122,product_en_0514804,reviewer_en_0437200,4,My granddaughter loves bath bombs and these were no different. Packaged very well. All of the roses make a circle with a heart saying love in the middle .they fizz in the tub awhile which I like and the smell is very good left her skin feelin soft. A little expensive but most bath bombs are. They were comparable to the bath bombs I have bought at a pricey boutique all in all I was satisfied,All of the roses make a circle with a heart saying love in the middle,en,beauty,2,0.003050269093364477,0.01395787950605154,0.9829918742179871,2
712,en_0396706,product_en_0854523,reviewer_en_0239703,1,Had to buy different filters because these wouldnt work with CV carbs,Dont buy low quality,en,automotive,0,0.4901005029678345,0.4081096947193146,0.10178982466459274,0
713,en_0246247,product_en_0516730,reviewer_en_0822895,4,Neck is lower than picture probably because of weight of this stretch knit but launders well.,Great for maternity too.,en,apparel,2,0.010562678799033165,0.07641486078500748,0.9130223989486694,2
714,en_0272981,product_en_0185226,reviewer_en_0895836,2,"The cup look and feels is sexy and slick. Only problem is the bad sipping design. If you're storing really hot tea/coffee, sipping through it can cause your lips to burn easily. I ended up having to open the lid each time I have need a drink.",The cup look and feels is sexy and slick. Only problem is the bad sipping design.,en,kitchen,0,0.10299868881702423,0.5139803290367126,0.38302096724510193,1
715,en_0995890,product_en_0350016,reviewer_en_0525118,1,After one week color started to fade and the snap began to peel .wish I never bought it,Junk,en,wireless,0,0.925154983997345,0.0679154247045517,0.006929532624781132,0
716,en_0905393,product_en_0151649,reviewer_en_0818377,2,This case is great but there is plastic that goes over the buttons on the side of the iPhone and it is very hard to use them through the plastic. Would be so much better if it was a cutout so you could easily use the phone features. The case itself it nice but wouldn’t recommend as it makes the phone harder to use.,Wouldn’t recommend,en,wireless,0,0.28913187980651855,0.6447141170501709,0.06615399569272995,1
717,en_0490546,product_en_0037935,reviewer_en_0405562,3,I like the look of this curtain and the fact that it is cotton and it blocks enough light for my purposes. But it is not a black out curtain and I do feel it is overpriced at $56 for one large panel.,Nice Curtain But Not Black Out,en,home,1,0.14102430641651154,0.6718950867652893,0.18708063662052155,1
718,en_0017859,product_en_0492638,reviewer_en_0089127,1,Don't buy this. Very low quality crank. The leverage mechanism is based on a single pot metal pin and broke on first use. Too late to return item.,Don't buy this. Very low quality crank. The ...,en,automotive,0,0.9798205494880676,0.011790047399699688,0.008389376103878021,0
719,en_0910650,product_en_0071226,reviewer_en_0576926,2,"Bought this product as a replacement to the factory screen protector. From the start there were issues, even though some were minor I might as well list all of them. 1. Box has the instructions but they had a giant product sticker covering all of it. I didn't need the insturctions, but this could be difficult for other people who might not know how to. 2. The edges are not smooth and beveled so mine already cracked with less than 2 weeks of use. I have normal items in my pocket such as keys my phone. 3. Case made a slight sticky noise when typing or using the phone, I just drowned out the sound eventually. 4. Glass seems to be a fingerprint magnet. Just after the application of the new screen I noticed how all the touches appeared on the screen. Overall. I will use the second one since I got two, don't want to waste money. Will most likely by a factory one and spend the extra $$. Only reason I replaced it was because the original screen protector cracked doing its job.","You get what you pay for, so next time buy a better product.",en,home,0,0.2165985107421875,0.5842052698135376,0.1991962343454361,1
720,en_0074848,product_en_0027532,reviewer_en_0907218,1,The pair I bought in the store for my girlfriend seemed like they were better. These headphones ended losing their Bluetooth capabilities. And after a few hard workouts the speaker lost power and was quiet.,Buying these in the store seemed like they were packaged better.,en,wireless,0,0.6554831862449646,0.3152492046356201,0.029267601668834686,0
721,en_0039246,product_en_0920204,reviewer_en_0198133,4,"I really like the look of this band, but there's one thing: when I'm wearing it, if the watch is centered on the top of my wrist, the buckle isn't centered on the bottom. It's almost as if the buckle portion of the band is slightly shorter than ""normal"" and the part with the holes is slightly longer (see image). On the whole I'm happy with it, but this quirk is distracting.",Comfortable but awkward?,en,wireless,2,0.0979020744562149,0.6408131718635559,0.2612847089767456,1
722,en_0497941,product_en_0962119,reviewer_en_0560135,1,Horrible!! Do not waste your money. They will not stay on.,Don’t waste your money,en,apparel,0,0.9795275330543518,0.011175037361681461,0.009297494776546955,0
723,en_0801678,product_en_0635750,reviewer_en_0097505,5,"Family pictures might just be the bane of my existence. Trying to find an affordable but talented photographer combined with having to get my kids and husband looking like we haven't just been hit by a bus is a task of Herculean effort. I was so excited to get this because now I can do MY OWN family pictures!!!! The tripod and remote feature make it a breeze to do it myself and I can take as long as I need to! Plus the tripod makes it easy for my kids to record videos for family, go live on social media and it works as a selfie stick so that we can take pictures on the go!!! This is such a great value for such a high quality product!",DIY Family Pics!,en,wireless,2,0.003922237548977137,0.009449779987335205,0.986627995967865,2
724,en_0905730,product_en_0583665,reviewer_en_0810417,4,I have been using this product for the past 5 days and it seems to work to an extent.,It whitens to an extent,en,beauty,2,0.00531788682565093,0.027672331780195236,0.9670097827911377,2
725,en_0740901,product_en_0346204,reviewer_en_0995650,5,My go to ! Taste delicious. Perfect combo with nut butter or fruit. Taste like dessert before bed !,Perfect combo with nut butter or fruit,en,drugstore,2,0.003474404104053974,0.009878857992589474,0.9866467714309692,2
726,en_0603155,product_en_0609001,reviewer_en_0414618,1,"My PT Therapist recommened this wobble cushion to sit on. However, I tried it for a couple of hours and got a but ache!",Not very comfortabe to sit on,en,sports,0,0.1520388424396515,0.5864813923835754,0.26147979497909546,1
727,en_0717594,product_en_0012324,reviewer_en_0774771,2,Good price and decent sound. Not reliable when it comes to pairing. Often times they disconnect and only one or neither works. My only other complaint is that the rubber seals fall off and stick in your ears.,Not bad for the price.,en,wireless,0,0.35695573687553406,0.5779089331626892,0.06513530761003494,1
728,en_0972645,product_en_0842470,reviewer_en_0579268,2,It was an ok eyeliner brush. Cute box.,Okay brush,en,beauty,0,0.024121282622218132,0.23128585517406464,0.7445929050445557,2
729,en_0548051,product_en_0053836,reviewer_en_0442558,1,The socks run extremely small and are so tight that they are difficult to get on. The MED socks (chose based on size chart) are tight on a woman's 7 1/2 shoe size foot and much too small for a man's 9 shoe size foot.,Socks run too small and are very tight fitting,en,sports,0,0.6469306945800781,0.3197641670703888,0.0333050936460495,0
730,en_0555406,product_en_0051766,reviewer_en_0879436,1,"Used this on a sleeper couch with the couch mattress under the blow up mattress and it leaked the second night I used it, wasted my money",Leaked the second night I used it,en,home,0,0.9810990691184998,0.014385314658284187,0.004515535198152065,0
731,en_0611467,product_en_0199965,reviewer_en_0222628,2,I'm disappointed I thought it would have actual glitter plus it doesn't look true to the pic mine came today and I gotta say I'm pretty disappointed but it will have to do because my daughter's birthday is next week.,Picture is misleading,en,apparel,0,0.32270899415016174,0.6298440098762512,0.04744695872068405,1
732,en_0537726,product_en_0440088,reviewer_en_0019605,5,"Nice band, I plan on buying more!",Good-looking Fitbit Band!,en,sports,2,0.004456294700503349,0.01850903406739235,0.9770346879959106,2
733,en_0387987,product_en_0887683,reviewer_en_0963378,4,I am unable to get any TV channels due to some 'location' error!!!,Four Stars,en,beauty,2,0.828518807888031,0.15206846594810486,0.019412659108638763,0
734,en_0361271,product_en_0334817,reviewer_en_0653052,2,"I have to return. Although my corning ware casserole is marked 2 1/2 quarts, this top does not fit...it is too small. Will investigate further to see if I can get the lid that will fit.",I have to return. Although my corning ware casserole ...,en,kitchen,0,0.9482437372207642,0.04670730605721474,0.005048905033618212,0
735,en_0498308,product_en_0009450,reviewer_en_0840354,2,Not keeping the food warm as expected. It is really just a storage container,Not keeping food warm,en,kitchen,0,0.7910628318786621,0.19326762855052948,0.015669595450162888,0
736,en_0630794,product_en_0239474,reviewer_en_0911559,2,The belt shown in the picture is the color I was expecting. The belt arrived and is much darker. Disappointing as I was trying to match sandals that are exactly what the picture is.,Color in Picture is Misleading,en,apparel,0,0.5582698583602905,0.41125786304473877,0.030472200363874435,0
737,en_0652388,product_en_0052709,reviewer_en_0073212,2,A few of the earbuds came broken. They ear piece fell off in transit. I bought them last year and had no issues.,Disappointed,en,wireless,0,0.7137534022331238,0.2473514825105667,0.038895148783922195,0
738,en_0716980,product_en_0867103,reviewer_en_0053792,2,Colors and graphic are great but the size was way smaller than I expected. Wouldn't be big enough for a twin sized bed.,Colors and graphic are great but the size was way smaller than I expected,en,home,0,0.17708039283752441,0.6693731546401978,0.15354640781879425,1
739,en_0463836,product_en_0998155,reviewer_en_0202715,5,"Fast delivery, fair price. Using the product to keep drains clear at a beauty salon.",Five Stars,en,home,2,0.005304958205670118,0.03189737722277641,0.9627977013587952,2
740,en_0739952,product_en_0757298,reviewer_en_0648892,4,"Fantastic product. We used it for the first time on a trip from Omaha, NE to Charleston, SC and held up great. The only issue we ran into was when it rained the last night of the trip (when we were parked at a hotel) and the straps allowed water to drip, and pool, inside the car. When we were driving, the rain was not an issue, but when parked, the straps leaked...a lot. Still, I would very much recommend this product and I'm glad we purchased it.",Would definitely buy again,en,automotive,2,0.0038601746782660484,0.019202476367354393,0.9769372940063477,2
741,en_0711843,product_en_0154554,reviewer_en_0987761,4,Takes some getting use to,Four Stars,en,drugstore,2,0.07794894278049469,0.38262462615966797,0.5394264459609985,2
742,en_0986820,product_en_0161076,reviewer_en_0693848,2,"This is definitely not the original replacement part which hoover used to make. It does say that in the description, but it also makes you feel like you are getting a decent replacement for it, meaning the bristles should be the same direction as the original replacement part. This fits, but the Bristles on the roller all go in a circular pattern. The original roller had bristles at the one end that went in a ""v"" so the dirt would be pushed toward the opening of the suction hole. This roller the bristles are continuous, like wrapped around with a single ribbon, so dirt gets pushed all out to one side and sometimes spits out of the bottom side of the vacuum because there isn't the ""v"" formation of bristles on the one end to stop the motion and push it toward the suction hole.",not a good replacement,en,home,0,0.38821569085121155,0.5564400553703308,0.05534428730607033,1
743,en_0045285,product_en_0684700,reviewer_en_0797908,2,"I wouldnt recommend this. I couldnt care less with rainbow patterns but when dust gets under, it defeats the purpose of a protective screen.",Dust gets under.,en,wireless,0,0.42772382497787476,0.4926697015762329,0.07960645109415054,1
744,en_0246358,product_en_0018425,reviewer_en_0422015,5,This product seems to work like a charm. No more nasty smells.,Good deal,en,home,2,0.003964611329138279,0.01799234375357628,0.9780430793762207,2
745,en_0776888,product_en_0459682,reviewer_en_0248082,5,Quality mats and easy to keep clean. Replaced bulky old blue tri-fold gym mat - simple to roll up and store or just leave out in basement and also in bedroom. Very supportive and looks nice!,Bought 2 of these for husband to stretch out,en,sports,2,0.0031894948333501816,0.010285833850502968,0.9865247011184692,2
746,en_0618971,product_en_0760707,reviewer_en_0426441,3,"Bic lighter sinks to the very bottom and difficult to remove. Interesting idea, but subpar execution. Not the easiest to use.",Get a toker poker,en,drugstore,1,0.6080562472343445,0.36798039078712463,0.023963363841176033,0
747,en_0645592,product_en_0956636,reviewer_en_0933760,3,The wig came fast. I washed it and it took three washes to get the water clear. The wig was making the. Water brown it smelled bad. The hair is nice after washing and air drying.,Ok,en,beauty,1,0.4012204110622406,0.4738854765892029,0.12489413470029831,1
748,en_0751804,product_en_0514124,reviewer_en_0859190,2,I've noticed no energy boost in this latest bottle. I've learned from visiting the GNC site that people are complaining about a formula change and are experiencing the same sluggish feelings I'm having. The bottle I received have green pills. I remember the yellow ones were much better.,No more energy boost,en,drugstore,0,0.6476276516914368,0.2989025413990021,0.053469832986593246,0
749,en_0761591,product_en_0250877,reviewer_en_0027883,1,"I would love to write a review, however, I never received my order.",Product didn't arrive,en,drugstore,0,0.9145524501800537,0.07560940831899643,0.00983812753111124,0
750,en_0571598,product_en_0010625,reviewer_en_0150355,2,The parakeets won't use the coconut. They hut it with their beaks sometimes but that is it. I am disappointed that it is so small. It looked bigger in the pictures. Seems to be sturdy and the birds wint get hurt.,Small but wont hurt the birds,en,lawn_and_garden,0,0.19975417852401733,0.6927469372749329,0.107498899102211,1
751,en_0930151,product_en_0351973,reviewer_en_0237364,3,Did not fit for laser that was recomed.,Three Stars,en,sports,1,0.7044916152954102,0.2669990360736847,0.028509339317679405,0
752,en_0985224,product_en_0100872,reviewer_en_0161005,4,"I like it, and am glad I purchased it. The only problem I'm having with it is the comes undone easily. The smallest size they carry is for a 26"" waste, and mine is a little smaller.",Nice belt,en,apparel,2,0.009944779798388481,0.09760502725839615,0.892450213432312,2
753,en_0108627,product_en_0993669,reviewer_en_0530288,2,"I bought two of these. One fit great, the other one piece would not properly fit and lock into the watch. No good for use at all then.",All piece do not fit properly.,en,wireless,0,0.9631627202033997,0.03235486149787903,0.004482371732592583,0
754,en_0350372,product_en_0251010,reviewer_en_0344714,4,Sooo many comes in a cute little zip log sorta bag. My daughter loves them enjoys having cute stuff in her hair so it makes hair time easier for us.,Kids will love them,en,beauty,2,0.005246943794190884,0.03126391023397446,0.9634891748428345,2
755,en_0925203,product_en_0501485,reviewer_en_0941237,1,I guess I’ll be lucky to get one Christmas out of the tree. I didn’t plan on it being disposed after one use,Lights giving out in less than a month,en,home,0,0.3302837908267975,0.5200459361076355,0.14967025816440582,1
