,review_id,product_id,reviewer_id,stars,text,review_title,language,product_category,label,pred_proba_label_negative,pred_proba_label_neutral,pred_proba_label_positive,pred_label
1067,en_0851938,product_en_0344099,reviewer_en_0092461,2,I like the top but the bottom was not sized correctly. I had to return it,Negative,en,apparel,0,0.6153799891471863,0.3592166304588318,0.025403376668691635,0
1068,en_0395709,product_en_0582570,reviewer_en_0088395,5,I love this product and would highly recommend it..,Brazilian Body Wraps Really Work,en,beauty,2,0.0032550001051276922,0.009252854622900486,0.9874922037124634,2
1069,en_0610506,product_en_0100194,reviewer_en_0320524,4,Like that they feel cool when on. Wanted them for sun protection while golfing.,"They seem to,work.",en,sports,2,0.019456086680293083,0.1327505260705948,0.8477934002876282,2
1070,en_0540935,product_en_0537311,reviewer_en_0654256,5,"We were looking for grinder for deer and elk meat to make into ground meat..this grinder works perfectly. It is noisy (as expected), but overall does a great job!",but overall does a great job!,en,kitchen,2,0.003545960644260049,0.021374186500906944,0.9750798344612122,2
1071,en_0048350,product_en_0511368,reviewer_en_0301196,1,What a wast of money. They fall apart and are hard to light and when they do burn they don't burn slow.,Don't buy.,en,drugstore,0,0.9461113214492798,0.04547995328903198,0.00840871874243021,0
1072,en_0018380,product_en_0109973,reviewer_en_0167179,3,"A little smaller than I expected, but super cute.",Cute,en,apparel,1,0.00448380783200264,0.029510650783777237,0.9660055637359619,2
1073,en_0909948,product_en_0066903,reviewer_en_0386145,5,Well made item. Great results.,Highly recommended,en,beauty,2,0.003475589444860816,0.011782422661781311,0.9847419261932373,2
1074,en_0383053,product_en_0898779,reviewer_en_0604864,2,Not for a truck driver,Two Stars,en,wireless,0,0.6385854482650757,0.31831786036491394,0.04309666529297829,0
1075,en_0645249,product_en_0743929,reviewer_en_0849715,1,Ordered as a birthday present 2 different times was “lost” in transit both times so I never received this item birthday past without the one thing they wanted most,Lost in transit twice,en,toy,0,0.9225660562515259,0.06791504472494125,0.00951894000172615,0
1076,en_0106047,product_en_0704788,reviewer_en_0848213,2,Just okay. Fabric not comfy,Good price. Poor fabric,en,apparel,0,0.08050243556499481,0.7439921498298645,0.17550547420978546,1
1077,en_0714343,product_en_0633339,reviewer_en_0013529,2,Purchased as a gage gift. Nothing else needs to be said.,"Purchased for a Friend getting Married, AGAIN.",en,drugstore,0,0.7805653810501099,0.17713885009288788,0.04229578748345375,0
1078,en_0982205,product_en_0643498,reviewer_en_0953385,5,"I am super happy with the quality of this ballast, very sturdy construction and provides a light every time I turn the key. Just what I needed!",Great product for a great price,en,automotive,2,0.0035014795139431953,0.008930918760597706,0.987567663192749,2
1079,en_0622412,product_en_0824236,reviewer_en_0405042,1,"Bought this thinking that it would work based off of the reviews. Starting clogging up on me. Unfortunately, it's passed the window to return. I should've bought a Bissell.",Bought this thinking that it would work based off of ...,en,home,0,0.8853601813316345,0.10465388745069504,0.00998597126454115,0
1080,en_0981004,product_en_0696644,reviewer_en_0980991,4,"I have purchased several of these balloons to the enjoyment of my children. I have only received one bad batch where the balloons looked like they had melted into one another. And the pump broke on the second good balloon. But other than that, loads of fun for your children and the adults that want to use their hot air to entertain them!",I have purchased several of these balloons to the enjoyment of my children,en,toy,2,0.035019658505916595,0.19223986566066742,0.7727404832839966,2
1081,en_0136153,product_en_0464227,reviewer_en_0439242,1,I bought two of these and NEITHER of them worked. I have a ball python that has a heat mat under his terrarium that works perfectly. I plugged both in programmed it to my desired temperature and left it in for a 24 hour period. The heat in the terrarium never got about 72 degrees F. This is extremely upsetting as I said neither of the two worked and my return window has already closed so I’m stuck with $50 worth of useless heat controllers.,Did not work at all.,en,lawn_and_garden,0,0.9826479554176331,0.012510282918810844,0.004841779358685017,0
1082,en_0843407,product_en_0042564,reviewer_en_0420538,1,"I loved these at first, but two of the 4 are already cracked after less than a month of use, they were not dropped or put in the dishwasher. Disappointed!!",Broken in less than a month,en,kitchen,0,0.9156821370124817,0.0782213881611824,0.006096509750932455,0
1083,en_0744215,product_en_0899045,reviewer_en_0377466,4,Its not AS nice as it is in the picture but it is still cute,Four Stars,en,apparel,2,0.05856671929359436,0.5180647373199463,0.42336857318878174,1
1084,en_0473621,product_en_0897696,reviewer_en_0409382,5,"In high school I had an Adidas bag for club soccer that was this style. Being that I didn't know this brand I was skeptical but this bag is even better than my Adidas. The zippers are good quality and the backpack straps are EXCELLENT. Way more comfortable than my previous bag. Highly recommended. The inside zipper pocket is great for keys and headphones for the gym, the shoe pockets are great (size 10 sneaks fits good). Outside mesh pocket is usually meant for a soccer ball, but i use it for damp clothes after swimming etc. For $23, just buy it.",Comfortable straps!,en,sports,2,0.003329898463562131,0.011217933148145676,0.9854521155357361,2
1085,en_0025829,product_en_0776431,reviewer_en_0646807,2,too big to look nice,Two Stars,en,apparel,0,0.6212159991264343,0.33754926919937134,0.04123467952013016,0
1086,en_0438576,product_en_0243771,reviewer_en_0450600,2,Cute style but...Sizing was completely off. Had to return. They were huge & baggy.,So huge,en,apparel,0,0.6308556199073792,0.343610018491745,0.025534378364682198,0
1087,en_0171363,product_en_0622545,reviewer_en_0821638,3,"Its a great gag gift, but it does not taste like bacon.",Does not tase like bacon,en,drugstore,1,0.10102201253175735,0.46235236525535583,0.436625599861145,1
1088,en_0532855,product_en_0442692,reviewer_en_0426070,3,It stopped working a few days of being used,It stopped working a few days after being used,en,lawn_and_garden,1,0.9533067941665649,0.03984661400318146,0.006846503354609013,0
1089,en_0480248,product_en_0050262,reviewer_en_0708709,5,The perfect pajamas for my sweet granddaughter that came to visit. She loved them.,Love the pajamas,en,apparel,2,0.003367829602211714,0.008872359991073608,0.9877597689628601,2
1090,en_0108451,product_en_0089418,reviewer_en_0198514,1,"I took note of the reviews that said the clock just stopped working, but decided to try it anyway because of its looks. And make no mistake, it is very good looking. Unfortunately it does not work. I even tried replacing the first fresh battery with another fresh battery. It ran for 2 hours and stopped again. I wouldn't be surprised to learn that Howard Miller changed their supplier for their clock movements. The low-cost provider can become very expensive if you have to handle a lot of returns and your brand is damaged.",Got it yesterday; returning it today,en,home,0,0.9532744288444519,0.041863180696964264,0.004862422589212656,0
1091,en_0522296,product_en_0727299,reviewer_en_0814738,1,I don’t know how this item is because I never RECEIVED IT!! I haven’t received anything that I ordered except the silk pajamas and the trench coat and the sexual toys. And I’m guessing cause they were placed in my mailbox!! I haven’t received my scooter nor the car!! I want my money back I don’t even want a delivery anymore!!,Never got my scooter not my car,en,toy,0,0.9805205464363098,0.011324609629809856,0.00815486628562212,0
1092,en_0271532,product_en_0122812,reviewer_en_0293671,4,Nice wallet but it sets off the metal detectors at the airport. I have to put the wallet in my bag.,Triggers metal detectors,en,apparel,2,0.15200278162956238,0.5913362503051758,0.25666096806526184,1
1093,en_0701228,product_en_0086844,reviewer_en_0047809,2,the product is fine. it's the shipping delays on what's supposed to be 2-day shipping that has me upset.,the product is fine. it's the shipping delays on what's supposed to ...,en,wireless,0,0.10861552506685257,0.5313080549240112,0.3600764572620392,1
1094,en_0109149,product_en_0006526,reviewer_en_0219850,1,"The shelf is great and suction cups seem fine and able to hold weight, however, it doesn’t sit level.",Not level!,en,lawn_and_garden,0,0.22625470161437988,0.6263335347175598,0.1474117487668991,1
1095,en_0831621,product_en_0869563,reviewer_en_0722678,5,Looks great and fits perfectly in my benz,Five Stars,en,wireless,2,0.003728541312739253,0.008364688605070114,0.987906813621521,2
1096,en_0034713,product_en_0114438,reviewer_en_0568047,2,"Bought on December 20, 2017 and as of today, August 20, 2019 one lamp is burnt out. Seems they should last longer.","Burnt out in under two years, car hasn’t been driven 8000 miles since they were installed",en,automotive,0,0.6440708637237549,0.3034621775150299,0.0524669848382473,0
1097,en_0531656,product_en_0757019,reviewer_en_0120208,2,Way too small for the price,Two Stars,en,toy,0,0.6871572732925415,0.28063035011291504,0.03221241757273674,0
1098,en_0909858,product_en_0409546,reviewer_en_0089508,1,"I emailed this seller trying to resolve this and so far have not heard back. I needed this for a theatre production, but settled for Walmart brand after this result. Not worth the hassle!!!",SHATTERED,en,beauty,0,0.9641107320785522,0.03121502883732319,0.004674290306866169,0
1099,en_0658798,product_en_0638788,reviewer_en_0414716,2,"The original website has cost of $99, why are some pieces more expensive here!?",Two Stars,en,apparel,0,0.6663046479225159,0.27390438318252563,0.05979101359844208,0
1100,en_0795736,product_en_0385368,reviewer_en_0903641,3,"These are cute and so is the packaging, but I ordered a small and it fits like a large. Had to return, wish x-small was offered for slim builds.",Inaccurate sizing,en,apparel,1,0.3462979197502136,0.5837081074714661,0.0699939876794815,1
1101,en_0023954,product_en_0805849,reviewer_en_0100428,1,These are nothing like the first bunch I bought. They don't stay lit. They barely smolder for more than 30 seconds. You have to stand right on top of them to get any scent!,VERY DISAPPOINTED,en,kitchen,0,0.9722609519958496,0.023319656029343605,0.00441941199824214,0
1102,en_0300636,product_en_0915002,reviewer_en_0754434,5,Mother in law loved them,Perfect,en,kitchen,2,0.00694102281704545,0.030409233644604683,0.9626497626304626,2
1103,en_0970009,product_en_0938161,reviewer_en_0528843,4,"It took a little help for my 6 year old to get started, but he was able to complete it on his own. I don't know about replay value, but I 30 minutes to put together another 30 to show everyone his accomplishment. It was worth it.",Worth it.,en,toy,2,0.0046875388361513615,0.030125578865408897,0.9651868939399719,2
1104,en_0763688,product_en_0937691,reviewer_en_0177417,4,"Not a fan of the straw. Some times if the straws not open just right it's like your tying to drink peanut butter out of the bottle, but it does keep my drinks ice cold for a long time. Might have to buy a different lid","Decent, Gets the job done",en,sports,2,0.16223688423633575,0.6630659699440002,0.17469719052314758,1
1105,en_0881851,product_en_0019140,reviewer_en_0184579,1,Three times I ordered 16 inch brackets and today for the third time I received 20 inch brackets. Packaging is labeled as 16 inch brackets but measure out at 20 inches.,Three times I ordered 16 inch brackets and today for ...,en,home,0,0.8404927849769592,0.1402992308139801,0.019207974895834923,0
1106,en_0089223,product_en_0576749,reviewer_en_0551128,2,Fits good ... weird material though,Two Stars,en,apparel,0,0.07953623682260513,0.4146841764450073,0.5057795643806458,2
1107,en_0057630,product_en_0022213,reviewer_en_0671592,2,Placed it on my phone and was unsticking...plastic material.,not durable,en,wireless,0,0.9124072790145874,0.07615914940834045,0.011433537118136883,0
1108,en_0184839,product_en_0090304,reviewer_en_0770328,4,Nice quality- heavier than I expected.,Perfect bedroom deco.,en,home,2,0.00875353254377842,0.07433713227510452,0.9169093370437622,2
1109,en_0796346,product_en_0452267,reviewer_en_0681015,5,My sister in law loved the decor and this added that special little touch any expecting mama deserves!,Great Touch,en,toy,2,0.0030242004431784153,0.013388835825026035,0.9835869669914246,2
1110,en_0560569,product_en_0574617,reviewer_en_0140855,1,All of them failed to charge IPhone & iPad after 2 / 3 months of normal use,One Star,en,wireless,0,0.9444794654846191,0.047155968844890594,0.00836455263197422,0
1111,en_0452076,product_en_0050995,reviewer_en_0720709,2,It’s ok and not that great,Ok,en,drugstore,0,0.11840663105249405,0.7096800804138184,0.171913281083107,1
1112,en_0975333,product_en_0502641,reviewer_en_0288430,5,"Take that strict managers that go beyond the store's dress policy. Pretty sure the customer's aren't looking at my white socks and black shoes when they come into the store, but here you go. Otherwise, these socks are sooo comfortable and hopefully are wash friendly (haven't seen yet, but will update). For the price, it's totally worth it and I love how the toes and the heel have different colors! Haven't had any trouble with them slipping off because they fit perfectly~",So far; perfect!,en,apparel,2,0.003196640172973275,0.01919197291135788,0.9776114225387573,2
1113,en_0840037,product_en_0177989,reviewer_en_0794376,3,Very cute but not a lot of product,Cute but not enough of the product,en,beauty,1,0.20914135873317719,0.6051328182220459,0.18572580814361572,1
1114,en_0472187,product_en_0830854,reviewer_en_0157152,3,Fade easily over the year I’ve had them.,Ehh,en,automotive,1,0.40952640771865845,0.49605879187583923,0.09441486746072769,1
1115,en_0156158,product_en_0078481,reviewer_en_0389414,2,"I bought this set for my son for Christmas because he is a huge Dinotrux fan, unfortunately two of the trucks were broke by Christmas night. The metal parts are well made, but the plastic is just junk.","Nice toys, but not well made.",en,toy,0,0.6594046354293823,0.30766603350639343,0.03292934596538544,0
1116,en_0569232,product_en_0893792,reviewer_en_0667654,2,"Unfortunately, these are only slightly better than nothing. They deflect some water but still allow cushions to get soaked with each rain. Probably will be ok for sun protection for non Sunbrella fabric cushions. We'll see.","Definitely not ""Waterproof""",en,lawn_and_garden,0,0.11429119110107422,0.6421732902526855,0.24353556334972382,1
1117,en_0869304,product_en_0701932,reviewer_en_0481986,5,Very nice dress! Cute and comfortable.,Great summer dress!,en,apparel,2,0.0031287504825741053,0.013156794011592865,0.9837144017219543,2
1118,en_0766579,product_en_0711781,reviewer_en_0809922,4,"Works great, and is good looking. My son complains that it rubs on the back of his neck though.",Four Stars,en,sports,2,0.00784104410558939,0.062313251197338104,0.9298457503318787,2
1119,en_0288696,product_en_0653626,reviewer_en_0271741,1,Broken when it arrived. I was able to basically tape it together as it was the handle but it just doesn't work well,Junk,en,lawn_and_garden,0,0.8603048324584961,0.13166643679141998,0.00802870187908411,0
1120,en_0330587,product_en_0572566,reviewer_en_0977620,1,"No support at all, don't waste you're money!",No support,en,drugstore,0,0.9812824726104736,0.010943070985376835,0.0077745141461491585,0
1121,en_0777017,product_en_0441291,reviewer_en_0451432,1,The strong smell of Emu bird oil drives me off the product,String smell,en,beauty,0,0.5604823231697083,0.35558661818504333,0.08393099159002304,0
1122,en_0234569,product_en_0538571,reviewer_en_0377169,2,I was pretty disappointed in this shirt! Looking at reviews people said how soft it was but when I got it I felt the exact opposite! The shirt is not only super rough (honestly feels like sand paper) BUT it is see through when i hold it in the air. It isn’t soft and the quality is not good which disappointed me as we were supposed to wear to Halloween party,Not what I expected,en,apparel,0,0.823857307434082,0.16502301394939423,0.011119713075459003,0
1123,en_0388120,product_en_0328697,reviewer_en_0217325,3,"The shipping time on these were amazing as we needed them in a pinch, but we found them to crumble easily and they didn't stay lit.",Broke Easily,en,home,1,0.47399601340293884,0.4759373366832733,0.05006664618849754,1
1124,en_0762916,product_en_0667255,reviewer_en_0675383,1,"This is not keeping time, we have replaced the battery twice, checks the hands and cannot understand why it won't work!!!","This is not keeping time, we have replaced the ...",en,home,0,0.9827343821525574,0.010954800993204117,0.006310828495770693,0
1125,en_0220510,product_en_0642181,reviewer_en_0635308,3,Hidden in the Q&A section is the important information that. YOU CAN'T TAKE THIS ON A PLANE.,Air Travel - NOT ALLOWED,en,wireless,1,0.2708725333213806,0.3506428599357605,0.3784846365451813,2
1126,en_0605964,product_en_0802496,reviewer_en_0325403,4,"Very nice, well made.",Four Stars,en,apparel,2,0.0033714582677930593,0.011153246276080608,0.9854753017425537,2
1127,en_0580112,product_en_0116588,reviewer_en_0069474,3,The skirt was pretty but the material wasn't what I expected and the waist was tight. It had no elastic,Ok,en,apparel,1,0.5057255029678345,0.45459192991256714,0.0396825447678566,0
1128,en_0551868,product_en_0472754,reviewer_en_0751617,3,Xmas gift so its just ok to me.,Three Stars,en,sports,1,0.020912788808345795,0.2194538414478302,0.7596333026885986,2
1129,en_0755516,product_en_0187706,reviewer_en_0669277,1,Product came damaged :(,Product was delivered with damages,en,lawn_and_garden,0,0.9084914922714233,0.07870343327522278,0.012805044651031494,0
1130,en_0546205,product_en_0588214,reviewer_en_0674277,3,The clear plastic casing cracked letting in moisture and making it impossible to use my phone while encased.,Moisture issue,en,wireless,1,0.9535221457481384,0.0401175394654274,0.006360318046063185,0
1131,en_0904707,product_en_0662738,reviewer_en_0937268,1,"these are misleading. if your beam is taller than the spoke provided, there's nothing for these hooks to anchor onto. I ended up getting a screw-in hook and attaching my own carabiners",these are misleading. if your beam is taller than ...,en,toy,0,0.8479382395744324,0.1390310376882553,0.013030673377215862,0
1132,en_0367567,product_en_0192718,reviewer_en_0888028,3,"This adhesive is great when you first get it, but after 3-4 weeks, the retention is so poor. I've ordered twice now and experienced the same results each time. Nearly all lashes are coming off within 1-2 weeks, even with proper prep and aftercare.",Great until it's not,en,beauty,1,0.9437668919563293,0.05022075027227402,0.006012325640767813,0
1133,en_0714012,product_en_0959317,reviewer_en_0838903,2,they tare at the bands easy.,low quality,en,toy,0,0.04491567984223366,0.1672893613576889,0.7877950072288513,2
1134,en_0487931,product_en_0360848,reviewer_en_0289867,4,Really fine detail. Bought for my nurse wife. She loved it!,Great Card!,en,home,2,0.002853203332051635,0.010740682482719421,0.986406147480011,2
1135,en_0420344,product_en_0698653,reviewer_en_0376367,1,"Doesn’t work! It quacks but that’s it, doesn’t even attempt to blow bubbles. Will return! Very disappointed as this was part of my son’s Easter basket!",Doesn’t blow bubbles!,en,toy,0,0.9797189235687256,0.013433057814836502,0.00684802420437336,0
1136,en_0449256,product_en_0678332,reviewer_en_0510828,2,"These feel cheap, like more like they should have been in the 20-30 dollar range. So yeah, these are a no go. The sound is uhh... That's okay. But if you have a big head, you're gonna suffer a great deal from how harsh of a clamp these have.","Ouch, they hurt!",en,wireless,0,0.9104426503181458,0.08148965984582901,0.008067728951573372,0
1137,en_0233145,product_en_0357339,reviewer_en_0784313,2,While the nail polish was cute it just didn’t stay on my daughters nails and wasn’t very dark in color. It was like paining a clear coat with glitter.,Disappointed,en,beauty,0,0.6749244928359985,0.30349379777908325,0.02158169634640217,0
1138,en_0405832,product_en_0792387,reviewer_en_0188583,5,"This is a very neat phone/camera stick! what's great about it is that it comes with a very unique mini tripod that you can use to take group photos, yet it's as compact and about the same weight as a small selfie stick. I've used it in my recent ski trip and everyone was amazed by it, setting it up and taking pictures is super easy, and there is even a remote control for triggering the photo function. Overall I'm extremely happy with it and would not hesitate to recommend it to others.",Great portable selfie stick!,en,wireless,2,0.0032635037787258625,0.013383203186094761,0.9833532571792603,2
1139,en_0905419,product_en_0054900,reviewer_en_0816297,2,I had it for a few months and it broke in two places. I have moved on to a different phone but just wanted to leave a warning about this case. The only good thing has going for it is that the back has a good grip and the blue color is nice.,Just an OK Case,en,wireless,0,0.7554823160171509,0.2235022634267807,0.021015414968132973,0
1140,en_0843266,product_en_0243917,reviewer_en_0790158,4,"works and fits perfect as described, I didn't like the sticky tape they used for wrapping, it won't go off even after washing or scrubbing.",Perfect fit for instant pot,en,kitchen,2,0.004046257585287094,0.022500939667224884,0.9734528064727783,2
1141,en_0677537,product_en_0877922,reviewer_en_0947304,5,Exactly the same as the one my 2013 Elantra GT came with. Sort essay to install.,Perfect,en,automotive,2,0.0037899238523095846,0.012108317576348782,0.9841017127037048,2
1142,en_0877391,product_en_0889201,reviewer_en_0449725,5,Extremely warm. My favorite cold weather hoodie.,Very warm.,en,apparel,2,0.004310912452638149,0.00963814090937376,0.9860510230064392,2
1143,en_0334613,product_en_0067763,reviewer_en_0709320,4,look for battery compartment on the side. Tried it of one car - showed excessive water in brake fluid. going to test it on a new can of fluid just to be sure.,accuracy of meter,en,automotive,2,0.7345985770225525,0.21523408591747284,0.050167422741651535,0
1144,en_0803021,product_en_0168013,reviewer_en_0633238,1,Stopped working after 4 months.,Doesn't last long.,en,wireless,0,0.9619380831718445,0.031805675476789474,0.006256254389882088,0
1145,en_0306344,product_en_0409107,reviewer_en_0457777,2,"Decent comfort, sound, and volume, but after 3 months use they now hold only about one minute's worth of charge.","Decent comfort, sound, and volume, but after ...",en,wireless,0,0.5145370960235596,0.45181772112846375,0.03364517539739609,0
1146,en_0323845,product_en_0310581,reviewer_en_0807055,3,"Box was damaged upon delivery. This is considered a collectible, and the Funko Pop box is torn....which will make it less valuable.",Ripped box,en,toy,1,0.7578929662704468,0.2218240648508072,0.020282894372940063,0
1147,en_0087568,product_en_0206416,reviewer_en_0637615,5,"The headphones arrived in good time as expected and have worked perfectly so far. The sound quality is very impressive and I appear to be lucky in that they stay on well and are comfortable when I am in the gym working hard on equipment and getting very hot. They didn't disappoint, they are so comfortable that if it wasn't for the music you could easily forget you were wearing them. Although they're not the best sounding headphone I own they are better than I expected for the price and more than adequate for a run.",The headphones arrived in good time as expected and have worked perfectly so far,en,wireless,2,0.0035146374721080065,0.022141609340906143,0.9743437767028809,2
1148,en_0388465,product_en_0917657,reviewer_en_0309595,2,It had great drying power until it stopped working 9 months later. I would not buy from this company again. As other reviews stated the plug falls out of the outlet,Don’t buy this!,en,beauty,0,0.9748269319534302,0.02125825732946396,0.0039148470386862755,0
1149,en_0517219,product_en_0193284,reviewer_en_0509056,4,"Nice shorts they did come with a tiny tiny hole maybe about a cm big, but its so minor i didn't bother returning them",Not bad,en,apparel,2,0.13638097047805786,0.5731385946273804,0.29048046469688416,1
1150,en_0995983,product_en_0786056,reviewer_en_0407009,5,"Went together in no time, very solid.",Nice outdoor table,en,lawn_and_garden,2,0.03770650178194046,0.03873315453529358,0.9235603213310242,2
1151,en_0377901,product_en_0991330,reviewer_en_0561963,5,"Used this for my baby shower, loved it.",Luxurious Thin Metallic Gold Ribbon,en,drugstore,2,0.003636901266872883,0.014457711018621922,0.9819053411483765,2
1152,en_0211191,product_en_0485505,reviewer_en_0892423,2,I like the feel and the costume but the zipper is bad going by see about a exchange,Really like it but bad zipper,en,apparel,0,0.2195514589548111,0.5947902798652649,0.1856582909822464,1
1153,en_0141495,product_en_0848246,reviewer_en_0013801,3,The retention spring pins were very short. Wouldn’t work on my Tundra. Had to reuse the ones that were in there already.,Short retention pins,en,automotive,1,0.8799944519996643,0.11126264929771423,0.008742878213524818,0
