,review_id,product_id,reviewer_id,stars,text,review_title,language,product_category,label,pred_proba_label_negative,pred_proba_label_neutral,pred_proba_label_positive,pred_label
311,en_0653274,product_en_0466834,reviewer_en_0396696,3,"Very disappointed 😞 the smoothie cup got stuck to the base locking ring. Was able to separate it from the base but was unable to unscrew the ring from cup . Called the company for replacement, They took more than 2 weeks to send another one saying it was out of stock. Finally got it and guess what IT GOT STUCK AGAIN.. Called again for replacement. Can't believe it. they don't want to refund it even though I brought it few months ago and it has 3 year warranty. Again the blade assembly is out of stock until October. So what do I use until then. Buy another one. Guess what it is made in China, ! I wish I knew this before ii",Very disappointed 😞,en,kitchen,1,0.9370604157447815,0.056866876780986786,0.006072721444070339,0
312,en_0262962,product_en_0599826,reviewer_en_0149348,4,"Very pretty, but smaller than I had thought.",Bright Christmas,en,lawn_and_garden,2,0.09053340554237366,0.46024513244628906,0.44922152161598206,1
313,en_0278142,product_en_0402055,reviewer_en_0793871,2,Need better quality control shitty sewing,Bad quality,en,kitchen,0,0.39520737528800964,0.49573755264282227,0.1090550497174263,1
314,en_0052357,product_en_0866347,reviewer_en_0813352,3,Bad (for consumer) design of the tube. You would be a looser if you throw the tube away when you can't squeeze more cream out easily bcz there is still a ton of cream inside (probably 1/4 of total quantity). I ended up cutting the tube in half and scooping out cream as I needed.,"Cream is ok, tube sucks",en,beauty,1,0.824029266834259,0.16311532258987427,0.01285544503480196,0
315,en_0805115,product_en_0296326,reviewer_en_0350900,3,"Its cute, but don't like the fit",but don't like the,en,apparel,1,0.16633975505828857,0.6363692283630371,0.1972910314798355,1
316,en_0938623,product_en_0795866,reviewer_en_0585893,3,You really need to do a better job of packing. I am surprised the light bar got here in one piece,beware of poor packing,en,automotive,1,0.4779382646083832,0.45006299018859863,0.0719987228512764,0
317,en_0891121,product_en_0042460,reviewer_en_0621277,1,Not as protective as other speck cases,Buy the otter box type,en,wireless,0,0.31225210428237915,0.6210211515426636,0.06672678887844086,1
318,en_0451050,product_en_0918977,reviewer_en_0194919,3,felt like a cheap Chinese knife,The grind lines were off,en,sports,1,0.6870032548904419,0.26482659578323364,0.04817015677690506,0
319,en_0280211,product_en_0058110,reviewer_en_0955694,5,This are so cute. The fabric is nice. They have a liner inside (shorts). And the seams line up so well with the fabric being striped,They are adorable!,en,apparel,2,0.003293562913313508,0.015007534064352512,0.9816988706588745,2
320,en_0290511,product_en_0964853,reviewer_en_0850986,5,A wish I would've ordered one size smaller (I am usually a S/M and am 5'3) and it is a little long. But it is great quality and a beautiful cover up! I have tied it up as a shirt with jean shorts too and it's really cute.,SUPER CUTE!,en,apparel,2,0.0033101679291576147,0.017355894669890404,0.9793339371681213,2
321,en_0834383,product_en_0458347,reviewer_en_0906571,5,Seems to thicken thinning hair.,Thicker hair,en,beauty,2,0.21633994579315186,0.5976485013961792,0.18601161241531372,1
322,en_0799985,product_en_0735619,reviewer_en_0773760,2,"Rail is bowed/bent ever slightly. Will not line up correctly. This is a high grade plastic/polymer, so not likely it occurred in shipping, but instead was a manufacturing defect. Not really usable unless it is put under high heat to attempt to straighten. That being said, quality of plastic/polymer is high grade and well finished. Just not straight...",Bowed/bent rail...,en,sports,0,0.8098799586296082,0.17473335564136505,0.015386708080768585,0
323,en_0938640,product_en_0313938,reviewer_en_0667945,2,"Bought this for a friend that likes League of Legends, and while they might appreciate the gift for how it looks, this plush is made terribly. The fur is matted, and clumps of the fur are falling out. It sheds everywhere, and there is something that feels like metal wiring inside of it that makes it very unpleasant to the touch.",this plush is made terribly. The fur is matted,en,toy,0,0.9614028334617615,0.0341106541454792,0.004486489575356245,0
324,en_0997515,product_en_0262528,reviewer_en_0845180,1,3 of the ornaments were broke or defective. 😩,Ornaments broke,en,home,0,0.7857638597488403,0.19745168089866638,0.016784543171525,0
325,en_0520335,product_en_0865436,reviewer_en_0191195,5,"Really like it, keeps my food cold use it every day.",Keeps food cold,en,kitchen,2,0.003164002439007163,0.013449537567794323,0.9833864569664001,2
326,en_0123377,product_en_0420539,reviewer_en_0796955,5,Work as expected. How they hold up is to be determined.,Good,en,lawn_and_garden,2,0.0075259702280163765,0.04711122810840607,0.9453628063201904,2
327,en_0612607,product_en_0543239,reviewer_en_0978660,5,Lovett! Ordered earrings for my daughter. Just what she was looking for. A great gift for the holidays.,Delivered on time and packed securely.,en,sports,2,0.003125156508758664,0.009728471748530865,0.9871463775634766,2
328,en_0963088,product_en_0506688,reviewer_en_0142040,1,"Bikini itself is great. However, was sent a small top and a medium bottom.",Sizing off,en,apparel,0,0.18386702239513397,0.5605115294456482,0.25562140345573425,1
329,en_0698814,product_en_0906777,reviewer_en_0293041,2,Doesn’t work. Used the base and dye multiple times and it barely colored anything. Takes two hours to dye multiple times just to get any color. I don’t have the time to sit around two hours every time I need to tidy up my goatee. Not worth the money,Not good,en,beauty,0,0.9791054129600525,0.013583727180957794,0.007310864049941301,0
330,en_0233711,product_en_0984264,reviewer_en_0615788,5,it looks good. I like it. gift for my wife.,Five Stars,en,kitchen,2,0.004611983895301819,0.024656379595398903,0.9707316756248474,2
331,en_0562540,product_en_0714838,reviewer_en_0690323,2,"Battery lasted just 4 days :( Weighing the exact same item has a 3-4 gram variance 2nd star because it is inexpensive, but you get what you pay for.",Battery lasted just 4 days. :(,en,kitchen,0,0.8979048728942871,0.08702103793621063,0.015074142254889011,0
332,en_0517953,product_en_0294632,reviewer_en_0353138,3,Very very small in sizing. Order up!,Three Stars,en,apparel,1,0.4727034270763397,0.37928199768066406,0.14801456034183502,0
333,en_0212656,product_en_0978988,reviewer_en_0527316,2,This product does not stay in place. The band is too slippery.,Slides off hair too easily,en,beauty,0,0.9647324085235596,0.031233184039592743,0.0040343888103961945,0
334,en_0472932,product_en_0619516,reviewer_en_0639109,1,Didn't have it ten minutes before it broke. As soon as I tried attaching it to the spigot it snapped in two.,lasted 10 minutes.,en,lawn_and_garden,0,0.9004166126251221,0.08968736976385117,0.009895977564156055,0
335,en_0113211,product_en_0256804,reviewer_en_0881265,3,"This costume is decent quality. However, it has listed that it includes a walkie talkie. It did not come with the walkie talkie. I also received the wrong size, which the seller was quick to fix. Great customer service there, but just disappointed it didn’t include everything listed on the description.",Missing items,en,toy,1,0.431345671415329,0.5341392159461975,0.03451511263847351,1
336,en_0861926,product_en_0762279,reviewer_en_0955013,2,Doesn't do what's advertised. Don't waste your time ordering this.,Don't waste your time ordering this,en,home,0,0.9823909401893616,0.012584313750267029,0.005024782847613096,0
337,en_0160269,product_en_0343637,reviewer_en_0152856,1,"I am an older woman in my 70’s. Ordered this chair thinking I could use it while recuperating from a broken shoulder and hand. Unfortunately, this chair is so heavy that I can’t even remove it from the box. The weight should be included in the description. My problem is that neither Amazon nor Best Choice Products will help me with returning it. It is useless to me. So disappointed in Amazon. I buy a lot of merchandise from Amazon since I cannot get out to shop. If the sellers they use are unresponsive, they need to help their customers. I’ll think twice before ordering again.",Heaven help you if you need to return this item!,en,lawn_and_garden,0,0.9686908721923828,0.026963748037815094,0.00434543052688241,0
338,en_0040839,product_en_0377281,reviewer_en_0416763,2,"I’m writing this review at 3:45 AM after taking 3 of these. I love my Natures Bounty Melatonin, they work.",Awake at 3:45 a.m.,en,drugstore,0,0.01029620785266161,0.054867833852767944,0.9348359107971191,2
339,en_0772900,product_en_0510899,reviewer_en_0730582,4,"I Really like it, but it’s not quite a love story; it’s very powerful, for something so small, and lightweight. However, the combination of how/where the hose exits the canister, and the size and number of wheels on the bottom, lead to a continual nuisance of tipping over. The plastic lever for switching out attachments is very cheap plastic, and broke as I was unpacking the vacuum. This may be a huge issue for some, but I don’t ever use attachments, so for me, no harm, no foul. The location of the power switch is a bit problematic as well, considering the other switch located in the mirror position on the back of the canister, causes the cord to retract. I’ve done this no less than 500 times. And no, for clarity, I am not a slow learner. That said, I do in fact, love that the vacuum has a retractable cord. I realize it is trivial, but for me, the winding and wrapping of a loose cord is just irritating. Not difficult, irritating. So the fact I don’t have to wind and wrap and wind and wrap, I’ll give it a star back, for the convenience it provides. Overall though, the pros far outweigh the cons.",Almost a match made in heaven,en,home,2,0.042337566614151,0.3317919373512268,0.6258704662322998,2
340,en_0201536,product_en_0876617,reviewer_en_0572211,5,"Its a shitty job, but hanes gets it done.",Five Stars,en,apparel,2,0.11508167535066605,0.4448431730270386,0.440075159072876,1
341,en_0404223,product_en_0750725,reviewer_en_0449335,3,My husband wore this shirt under his regular shirt and it started chafing him. Uncomfortable,Wouldn’t buy again,en,apparel,1,0.8451546430587769,0.14136293530464172,0.013482433743774891,0
342,en_0362534,product_en_0184209,reviewer_en_0737198,1,"Shipping was horrendous package didn’t arrive Friday as scheduled and paid for, I’m going to look like a complete jackass, I’m filing a complaint with everybody I can file a complaint with for the rest of my life I’m so mad",Warning,en,lawn_and_garden,0,0.9750317931175232,0.01740325056016445,0.007564963307231665,0
343,en_0278338,product_en_0187502,reviewer_en_0253425,2,"While I really like the simplicity and concept of the La Luna white noise machine, I found the fan sound to be insufficient in volume. It simply doesn't get loud enough, even on the loudest setting. If the volume were louder, this would be a winner!",Sound is Too Quiet,en,drugstore,0,0.4895789921283722,0.4681425094604492,0.04227855056524277,0
344,en_0150314,product_en_0118802,reviewer_en_0862051,3,"Doesn't grind all chia/flax seeds unless you regrind a few times, but eventually does the job. The grinder works, but not as smoothly as I thought. I would have made a different purchase had I known in advance.","It works eventually, make a different choice",en,kitchen,1,0.04533514007925987,0.48145759105682373,0.4732073247432709,1
345,en_0216262,product_en_0723002,reviewer_en_0194836,2,"Well, I really like the product and I really want to be able to play it. The problem is, when I got it in the mail, it was missing the title deeds. I called the company that makes it and they exchanged it for me, but I just got the replacement in the mail and the same title deeds were missing. So frustrating.",Pieces Missing,en,toy,0,0.4752829968929291,0.47538378834724426,0.04933316633105278,1
346,en_0095771,product_en_0068241,reviewer_en_0597940,4,Just what I needed works great.,Four Stars,en,kitchen,2,0.0034561725333333015,0.010330136865377426,0.9862136244773865,2
347,en_0462736,product_en_0791529,reviewer_en_0419065,2,This machine is nowhere near as good as my old Beehive Blender. This one struggles with smoothies and my old one didn't. This one overheats and I have to stop and stir the mixture so it will blend. Not good at all.,This machine is nowhere near as good as my old Beehive Blender,en,kitchen,0,0.9761501550674438,0.02005123160779476,0.0037985469680279493,0
348,en_0559150,product_en_0777760,reviewer_en_0778865,4,My husband and I like the blanket. It is a quality product. We have the full size blanket. I am waking up feeling more rested. I wear an activity tracker and have noticed my restful sleep time has increased since I started using it.,Quality Product,en,home,2,0.005052002612501383,0.028820298612117767,0.9661277532577515,2
349,en_0190619,product_en_0171461,reviewer_en_0712731,3,I suppose you pay for what you get. A cheap material. And doesn't let your skin breathe,Three Stars,en,apparel,1,0.8202210068702698,0.15929439663887024,0.02048456110060215,0
350,en_0482138,product_en_0176997,reviewer_en_0672326,2,The lotions is too liquidy and does not apply nicely. It leaves me sticky. I would like to return but it looks like that’s not optional.,Too liquidy,en,beauty,0,0.9106045961380005,0.0834856852889061,0.005909671541303396,0
351,en_0218486,product_en_0356430,reviewer_en_0573825,1,"Bought this as a Christmas present and the remote did not work with the droid, was sent a second one and it had the same issue. I do not recommend this to anyone.",Remote doesn't work with toy,en,toy,0,0.9831489324569702,0.01130935363471508,0.005541689693927765,0
352,en_0199788,product_en_0976712,reviewer_en_0538678,2,"But I couldn't. Perhaps my torso is too long, but the open cups were made waaaaay too large and the torso was not long enough. This caused a super weird gap between my breasts and beneath the open cups. I love the material, but it just did not fit right.",I Wanted To Love This....,en,apparel,0,0.7479324340820312,0.2379702478647232,0.014097321778535843,0
353,en_0028355,product_en_0031336,reviewer_en_0729421,1,"The umbrella is quite large. 3+ people can easily fit under it. It worked well for shade but rain is another story. It leaks from the top, in ththe center, where the handle meets the fabric of the umbrella. I reached out to the seller but was directed the contact Amazon. Because I am outside of the 30 day window, I am stuck with an umbrella that can only be used for shade. So this was a waste.","Good for shade, horrible for rain",en,sports,0,0.9578237533569336,0.037354256957769394,0.004822005517780781,0
354,en_0118501,product_en_0736611,reviewer_en_0418425,4,Not sure about the weights it can handle and its stability. Folds up nicely.,Kneeling bench/seat.,en,kitchen,2,0.03880617022514343,0.3245908319950104,0.6366029977798462,2
355,en_0369897,product_en_0325523,reviewer_en_0288009,5,Great product easy to install with definitely recommend to anybody that wants an easy durable screen protect of excellent quality.,Good product easy to install,en,wireless,2,0.0032960777170956135,0.009319882839918137,0.9873839616775513,2
356,en_0821283,product_en_0391774,reviewer_en_0677550,4,"Very compactable and light weight. The stakes are durable and tie out points are well made. Wish it had a few more tie outs on the sides. Mine only came with one on each corner, one in the middle of each side and a center tie out. Used this as a lean-to shelter over my tent. The heat from the fire rolled right into my tent and was very comfortable in 24 degree weather. I pulled, wrenched and stretched this tarp with no issues. Also love that it is very easy to fold back up into its pouch.",Compactable and light weight,en,sports,2,0.004396604374051094,0.028919925913214684,0.9666835069656372,2
357,en_0507412,product_en_0752492,reviewer_en_0606410,5,"I got this to do shoulder stretches, holding the cable with both hands and stretching my arms out to the side. It proved to long to do this holding it by the handles. I didn’t do much research though so that’s my bad, it’s good quality for the price so I’m still giving it 5 stars. I’m sure I’ll find a use for it","Too long for me to do arm stretches, but good quality",en,sports,2,0.007606740575283766,0.03807346895337105,0.9543197751045227,2
358,en_0773649,product_en_0072593,reviewer_en_0505999,1,I have called back the same day i received it and got a return shipment and today I am still waiting to pick this up to get my return..,returns,en,apparel,0,0.9523656368255615,0.039930038154125214,0.007704367861151695,0
359,en_0307661,product_en_0509601,reviewer_en_0796910,1,unless i have something set wrong. this is the worst camera i have ever owned. not happy . way over priced,this is the worst camera i have ever owned,en,sports,0,0.9817028641700745,0.01146489568054676,0.006832187529653311,0
360,en_0645723,product_en_0147349,reviewer_en_0886202,3,Had trouble staying on,Eh,en,wireless,1,0.48869091272354126,0.4065701961517334,0.10473883152008057,0
361,en_0588434,product_en_0238619,reviewer_en_0095246,4,These do a great job of keeping drinks cold. They are attractive and fit nicely in even a smaller hand. The only reason I'm giving them four stars is that they have to be hand washed and I prefer to throw everything in the dishwasher.,Do the job,en,kitchen,2,0.013324569910764694,0.05819818377494812,0.9284772276878357,2
362,en_0952852,product_en_0918506,reviewer_en_0027951,2,"As a cane, it's just OK. Joints are wabbly. The flash light is useless. I thought the batteries were dead so I bough new batteries and it's just as dim. You have about 3 inches of light visibility.",Flashlight is worthless,en,drugstore,0,0.2755875885486603,0.6619551181793213,0.06245725601911545,1
363,en_0101530,product_en_0928209,reviewer_en_0498979,4,"The massager is pretty simple to use. I like the length, it wraps the body well. I mostly use it in the stomach area for a few minutes, and interestingly after a few days it felt like the ab muscles had worked out, because it felt a bit tight. The massager says to not use it for more than 15 minutes in an area. The cord is pretty long, which is nice. And the remote for it is so simple, it's just a knob to change the intensity of the vibration. I like that you can take the massager out of the velcro wrap/pouch thing. I think the only annoying thing for me is the zipper, when I have the massager ON, due to the vibrations, the zipper starts tapping on the zipper teeth. Overall, I think the massager is pretty useful.","Works well, great length",en,drugstore,2,0.013096733018755913,0.1592404693365097,0.8276628255844116,2
364,en_0920932,product_en_0837424,reviewer_en_0328249,2,We purchased this as a gift and after a few uses the plastic lid cracked. We contacted the company but were sent the wrong lid twice and now they are not responding to my emails. Poor customers service.,Poor customer service,en,kitchen,0,0.9785301089286804,0.01756960339844227,0.0039003610145300627,0
365,en_0008769,product_en_0963910,reviewer_en_0731132,3,"Husband complains how runny the product is. When he applies, it runs down his neck or toward his forehead.",Husband complains how runny the product is. When he ...,en,drugstore,1,0.4211830496788025,0.511877179145813,0.0669398084282875,1
366,en_0222613,product_en_0953761,reviewer_en_0706535,1,I guess I misread the description because I saw that it was 2 baskets. I was shocked when only one arrived. I would never have paid $45 for 1 basket. I chose this because I am disabled and I thought that this basket would make laundry day easier. I can't return it because there is no way I can haul around the huge box it came in. I feel stuck with it and angry that you charge $45 for 1 laundry basket.,I guess I misread the description because I saw that ...,en,home,0,0.8228484988212585,0.16138975322246552,0.015761736780405045,0
367,en_0463925,product_en_0781445,reviewer_en_0755357,4,"Not as good as the old US made files, but perfectly acceptable quality. I would purchase again.",Good/Acceptable Quality,en,beauty,2,0.0035745284985750914,0.022806892171502113,0.9736185669898987,2
368,en_0283641,product_en_0448750,reviewer_en_0189578,3,"Spelling errors... Ammo has two ""m"", not one. And nevermind is one word, not two. ""Never mind"" has a totally different meaning than ""nevermind"". Other signs seem okay. So, overall a decent deal even if you don't use the two screwed up ones. Thinner than I expected.",Spelling errors!,en,lawn_and_garden,1,0.056599799543619156,0.6814168691635132,0.26198336482048035,1
369,en_0036278,product_en_0364299,reviewer_en_0502576,3,It doesn’t show the color in the day as much but in a dark room it’s pretry cool.,Having to rotate the wheel for taking pictures to uncover the flash is kind of annoying.,en,wireless,1,0.1492735892534256,0.6767181754112244,0.17400819063186646,1
370,en_0888901,product_en_0701390,reviewer_en_0281668,5,"I have been decorating my living room with a farmhouse theme. I was working on ordering items to do a farmhouse gallery wall and started looking for a “key” to add to the gallery. I came across this iron key and decided to order it. It looks exactly as pictured. It is nice and heavy, but not too heavy. It was very easy to hang with a nail. I love it! You can not go wrong ordering this at all!!",Awesome...,en,home,2,0.003975413739681244,0.009357831440865993,0.986666738986969,2
371,en_0610621,product_en_0633533,reviewer_en_0605872,2,Parts were too little,Parts too small,en,toy,0,0.6694902181625366,0.2964637279510498,0.03404606878757477,0
372,en_0108952,product_en_0824779,reviewer_en_0461271,5,Matched the factory paint.,Exact match; can’t go wrong.,en,automotive,2,0.00845587532967329,0.053547196090221405,0.9379969239234924,2
373,en_0399620,product_en_0044693,reviewer_en_0941078,1,"I do not like the trio of shampoo, conditioner and leave-in conditioner because I do not care for the fragrance of them, I left the leave-in conditioner in and styling gel and it turned white so I'm returning asap. I don't know if I will order any more of their product",Unhappy customer,en,beauty,0,0.8015984296798706,0.18510529398918152,0.013296311721205711,0
374,en_0360732,product_en_0897725,reviewer_en_0878035,1,"Received this mixer in July. Didn’t use it until now. Big mistake!! It is broken - the mixer makes a loud noise while mixing, and the beaters don’t spin smoothly. My return window is over, and now I have a broken mixer.",Received broken mixer!!,en,kitchen,0,0.9817215204238892,0.013934976421296597,0.004343515262007713,0
375,en_0825524,product_en_0948525,reviewer_en_0029262,3,"Bought this to take to the shooting range. Tired of just standard target shooting. Really like these targets. They r a lot more fun and really hold up. They really do ""heal"" themselves. Been using a Glock 19 on it. The only reason I give it a 3 and the only Down side is just that it doesn't move much. Bullet goes thru and occasionally it moves/turns over. I also have the top hat and ball version of these. I prefer those because they move and bounce around, more fun. Buy these but get the ones that move more.",Heal themselves and last.,en,sports,1,0.01923365890979767,0.2578775882720947,0.7228887677192688,2
376,en_0458927,product_en_0212208,reviewer_en_0396392,2,"I really like how it looks so sleek and conforms to the edges of my phone with the aluminum trim but it doesn’t adhere well at all, especially with the corners. With a case on, it presses on the corners lifting them more making a space/air almost an inch into the center, making the touch screen a inconvenience and a pain to easily press options on the screen. Looks great except the air in between the screen and protector, which ultimately makes it look like crap and hard to use....","Great concept, terrible overall application....",en,wireless,0,0.8414149880409241,0.1491052806377411,0.009479650296270847,0
377,en_0807352,product_en_0228407,reviewer_en_0764049,4,"It has a nice feel and red color stripes. A little shorter then expected; therefore, I hanged dry instead of the dryer. Used the shirt for a pirate outfit.",Nice feel and red color stripes.,en,apparel,2,0.02899150736629963,0.1997397094964981,0.7712687849998474,2
